solution,title,source,url
Leave Half to Nature,Half the Earth Relatively Intact From Global Human Influence,SciTechDaily,https://scitechdaily.com/half-the-earth-relatively-intact-from-global-human-influence-clear-opportunities-to-conserve-what-remains/
Leave Half to Nature,Should we give up half of the Earth to wildlife?,The Guardian,https://www.theguardian.com/environment/2018/feb/18/should-we-give-half-planet-earth-wildlife-nature-reserve
Leave Half to Nature,"To ensure a stable planet, 30% of Earth needs protections by 2030",National Geographic,https://www.nationalgeographic.com/environment/article/conservation-groups-call-for-protecting-30-percent-earth-2030
Protect Ecosystems,Advancing Biodiversity-Positive Nature-Based Climate Solutions,International Institute for Sustainable Development,https://www.iisd.org/articles/insight/advancing-biodiversity-positive-nature-based-climate-solutions
Protect Ecosystems,8 nature-based climate solutions that protect our planet,International Fund for Animal Welfare,https://www.ifaw.org/international/journal/nature-based-climate-solutions-protect-planet
Protect Ecosystems,Nature protection and restoration,European Environment Agency,https://www.eea.europa.eu/en/topics/in-depth/nature-protection-and-restoration
Protect Ecosystems,"More action needed to protect freshwater ecosystems, report says",Mongabay,https://news.mongabay.com/2023/10/more-action-needed-to-protect-freshwater-ecosystems-report-says/
Protect Ecosystems,The effectiveness of global protected areas for climate change mitigation,Nature,https://www.nature.com/articles/s41467-023-38073-9
Protect Ecosystems,Climate change challenges marine conservation efforts in Atlantic Canada,The Conversation,https://theconversation.com/climate-change-challenges-marine-conservation-efforts-in-atlantic-canada-211580
Restore Ecosystems,Comment: Why business leaders are calling on the EU to pass the Nature Restoration Law,Reuters,https://www.reuters.com/sustainability/land-use-biodiversity/comment-why-business-leaders-are-calling-eu-pass-nature-restoration-law-2023-06-21/
Restore Ecosystems,State of nature in Europe: Damaged ecosystems need restoration,European Environment Agency,https://www.eea.europa.eu/en/newsroom/news/ecosystems-need-restoration
Restore Ecosystems,The uphill battle to protect Europe's biodiversity,International Fund for Animal Welfare,https://www.ifaw.org/international/journal/uphill-battle-protect-europe-biodiversity
Restore Ecosystems,Nature restoration: Council and Parliament reach agreement,Consilium.europa.eu,https://www.consilium.europa.eu/en/press/press-releases/2023/11/09/nature-restoration-council-and-parliament-reach-agreement-on-new-rules-to-restore-and-preserve-degraded-habitats-in-the-eu/
Restore Ecosystems,EU negotiators agree historic law to restore Europe's nature,EURACTIV.com,https://www.euractiv.com/section/climate-environment/news/eu-negotiators-agree-historic-law-to-restore-europes-nature/
Restore Ecosystems,EU lawmakers pass nature restoration bill in razor-thin vote,DW,https://www.dw.com/en/eu-lawmakers-pass-nature-restoration-bill-in-razor-thin-vote/a-66199587
Electric Car,Electric vehicles,European Environment Agency,https://www.eea.europa.eu/en/topics/in-depth/electric-vehicles
Electric Car,Current Climate: The Best (and Worst) States To Buy An Electric Car,Forbes,https://www.forbes.com/sites/alanohnsman/2023/11/11/current-climate-greenlands-glaciers-are-melting-faster/
Electric Car,"A New Law Supercharged Electric Car Manufacturing, but Not Sales",The New York Times,https://www.nytimes.com/2023/11/08/business/energy-environment/electric-vehicles-biden.html
Electric Car,"Yes, electric vehicles are better for the environment",Vital Signs,https://vitalsigns.edf.org/story/yes-electric-vehicles-are-better-environment-and-answers-more-questions-about-evs
Electric Car,Climate protection: Electric vehicles on the rise locally,My Edmonds News,https://myedmondsnews.com/2023/11/climate-protection-electric-vehicles-on-the-rise-locally/
Electric Car,"Biden's climate law boosts EV leasing, but sales trends remain unchanged ",Investing.com,https://www.investing.com/news/stock-market-news/bidens-climate-law-boosts-ev-leasing-but-sales-trends-remain-unchanged-93CH-3226834
No Car,"Trips on public transport, walking and riding must triple to see genuine transport emissions reduction",Climate Council,https://www.climatecouncil.org.au/resources/trips-on-public-transport-walking-and-riding-must-triple-see-genuine-transport-emissions-reduction/
No Car,Accelerating Sweden's climate action in transportation,Stockholm Environment Institute,https://www.sei.org/perspectives/swedens-transport-climate-action/
No Car,Public and active transport is in decline,Business Green,https://www.businessgreen.com/news-analysis/4119727/public-active-transport-decline-businesses-about
No Car,"Private vehicle usage must be halved to cut emissions, Climate Council says",ABC,https://www.abc.net.au/news/2023-05-22/climate-council-transport-report-more-public-active-transport/102374038
No Car,Climate Council urges Australians to triple bike riding and walking,Bicycle Network,https://bicyclenetwork.com.au/newsroom/2023/05/24/climate-council-urges-australians-to-triple-bike-riding-and-walking/
No Car,Changing how we move: the power of active transport,WSP,https://bicyclenetwork.com.au/newsroom/2023/05/24/climate-council-urges-australians-to-triple-bike-riding-and-walking/
No Flying,The No-Jet Set: They've Given Up Flying to Save the Planet,The New York Times,https://www.vox.com/climate/23922939/airline-united-climate-change-sustainable-fuel-emissions-offset-saf
No Flying,I'm not going to give up on my principles': Meet the Italian scientist fired for refusing to fly,Euronews.com,https://www.euronews.com/green/2023/10/25/im-not-going-to-give-up-on-my-principles-meet-the-italian-scientist-fired-for-refusing-to-
No Flying,The climate change proposal which means you'd never see the Mediterranean again,The Telegraph,https://www.telegraph.co.uk/travel/news/c40-cities-climate-change-proposal-one-flight/
No Flying,France bans short-haul flights to cut carbon emissions,BBC,https://www.bbc.com/news/world-europe-65687665
No Flying,85% of global companies don’t have credible plans to reduce corporate flying emissions,Transport & Environment,https://www.transportenvironment.org/discover/85-of-global-companies-dont-have-credible-plans-to-reduce-corporate-flying-emissions/
No Flying,How to make climate-neutral aviation fly,Nature,https://www.nature.com/articles/s41467-023-39749-y
Composting,The case for compost: why recycling food waste is so much better than sending it to landfill,The Conversation,https://theconversation.com/the-case-for-compost-why-recycling-food-waste-is-so-much-better-than-sending-it-to-landfill-205583
Composting,Composting: The simple climate solution you can do at home,One Earth,https://www.oneearth.org/composting-the-simple-climate-solution-you-can-do-at-home/
Composting,Transforming Climate Change with Composting Technology,Environmental Protection,https://eponline.com/articles/2023/10/27/transforming-climate-change-with-composting-technology-a-sustainable-solution.aspx?m=1
Composting,Opinion: Composting organic waste helps combat climate change,The Mercury News,https://www.google.com/search?q=climate+change+%2BComposting&client=safari&sca_esv=581534822&rls=en&biw=1512&bih=841&tbm=nws&sxsrf=AM9HkKm7QHWOkP0WcS7y_xDznrmag31LGg%3A1699719861090&ei=tapPZYX7BIuP9u8PurGFgA4&ved=0ahUKEwjFqab0rbyCAxWLh_0HHbpYAeAQ4dUDCAw&uact=5&oq=climate+change+%2BComposting&gs_lp=Egxnd3Mtd2l6LW5ld3MiGmNsaW1hdGUgY2hhbmdlICtDb21wb3N0aW5nSLcCUABYAHAAeACQAQCYAVGgAVGqAQExuAEDyAEA-AEC-AEBiAYB&sclient=gws-wiz-news
Composting,The City Kicks Off Its Food Waste Composting Program,City of Toledo,https://toledo.oh.gov/news/2023/10/25/the-city-kicks-off-its-food-waste-composting-program
Composting,Assessing the climate change mitigation potential from food waste composting,Nature,https://www.nature.com/articles/s41598-023-34174-z
Recycling,EO Guides: How To Introduce Recycling Into Your Business,Earth.Org,https://earth.org/eo-guides-how-to-introduce-recycling-into-your-business/
Recycling,Perspectives on plastic pollution and climate change issues,The World Economic Forum,https://www.weforum.org/agenda/2023/06/plastic-pollution-and-climate-change-perspectives-on-the-path-forward/
Recycling,Tennessee | Molecular Recycling Facility,Eastman,https://www.eastman.com/en/sustainability/environmental/circularity/site-locations/tennessee-site
Recycling,Trash or Recycling? Why Plastic Keeps Us Guessing.,The New York Times,https://www.nytimes.com/interactive/2022/04/21/climate/plastics-recycling-trash-environment.html
Recycling,Advanced recycling: Opportunities for growth,McKinsey,https://www.mckinsey.com/industries/chemicals/our-insights/advanced-recycling-opportunities-for-growth
Recycling,You're doing it wrong: Recycling and other myths about tackling climate change,Washington Post,https://www.washingtonpost.com/climate-solutions/2023/08/28/climate-action-poll/
Zero Waste,UK's 1st zero-waste theater leads the way in sustainable art,Anadolu Ajansı,https://www.aa.com.tr/en/culture/uks-1st-zero-waste-theater-leads-the-way-in-sustainable-art/2970861
Zero Waste,Press Conference: World Cities Day 2023 and new zero-waste initiatives,UN Web TV,https://media.un.org/en/asset/k1z/k1zaoh5oqk
Zero Waste,EU single-use beverage container industry unlikely to achieve climate targets,Zero Waste Europe,https://zerowasteeurope.eu/press-release/eu-single-use-beverage-container-industry-unlikely-to-achieve-climate-targets/
Zero Waste,Rubicon Leads Zero-Waste Efforts in Grocery Sector,Environment+Energy Leader,https://www.environmentenergyleader.com/2023/09/rubicon-leads-zero-waste-efforts-in-grocery-sector/
Zero Waste,UN zero waste board holds first meeting in Istanbul,Daily Sabah,https://www.dailysabah.com/politics/un-zero-waste-board-holds-first-meeting-in-istanbul/news
Zero Waste,zero-waste journey: An interview with Melissa Tan - Greenpeace International,Greenpeace,https://www.greenpeace.org/international/story/63171/a-zero-waste-journey-an-interview-with-melissa-tan/
